{
  "schema_version": "1.0",
  "generated_from": [
    "README.md",
    "docs/00_lifecycle.md",
    "docs/01_principles.md",
    "docs/05_operating_playbook.md",
    "docs/06_session_bootstrap.md",
    "HARNESS.md"
  ],
  "authority": {
    "english_markdown_authoritative": true,
    "machine_summary_kind": "derived_compact",
    "chinese_reference_kind": "generated_reference_only"
  },
  "startup": {
    "machine_default_entrypoint": "generated/protocol_compact.json",
    "human_authority_refs": [
      "README.md",
      "docs/00_lifecycle.md",
      "docs/01_principles.md",
      "docs/05_operating_playbook.md",
      "docs/06_session_bootstrap.md",
      "HARNESS.md"
    ],
    "global_bootstrap_files": [
      "`generated/protocol_compact.json`"
    ],
    "automatic_reading_path_steps": [
      "run `Project Preflight`",
      "return a short `Preflight Summary`",
      "classify the project state as `ready`, `bootstrap_required`, or `blocked`",
      "map the scene-specific path from [docs/00_lifecycle.md](docs/00_lifecycle.md)",
      "activate the first role",
      "continue automatically only when safe"
    ],
    "minimum_startup_checklist": [
      "`<PROJECT_ROOT>/CONSTITUTION.md`",
      "`<PROJECT_ROOT>/SCOPE.md`",
      "`<PROJECT_ROOT>/DECISIONS.md`",
      "`<PROJECT_ROOT>/SESSION_STATE.md`",
      "`<PROJECT_ROOT>/research/*.md`",
      "`<PROJECT_ROOT>/experience_prompts/*.md`",
      "`<PROJECT_ROOT>/DATA_MODEL.md`",
      "`<PROJECT_ROOT>/API_CONTRACT.md` or `<PROJECT_ROOT>/openapi.yaml`"
    ]
  },
  "scenes": {
    "greenfield": {
      "required_reads": [
        "`docs/01_principles.md`",
        "`docs/02_artifacts.md`",
        "core templates for constitution, scope, FB, MB, quality, and session state"
      ],
      "first_role": [
        "`Spec Architect`"
      ],
      "first_action": [
        "ask business questions until the 8 ontology elements and affected layers can be written",
        "if external facts or tool discovery would materially help, request user approval before any system-triggered research"
      ],
      "do_not": [
        "start coding",
        "force early technical stack choices"
      ]
    },
    "expansion": {
      "required_reads": [
        "`<PROJECT_ROOT>/CONSTITUTION.md`",
        "`<PROJECT_ROOT>/SCOPE.md`",
        "`<PROJECT_ROOT>/DECISIONS.md`",
        "`<PROJECT_ROOT>/SESSION_STATE.md`",
        "`docs/02_artifacts.md`",
        "`docs/03_mission_blocks.md`",
        "`<PROJECT_ROOT>/QUALITY_RULEBOOK.md`",
        "`<PROJECT_ROOT>/QUALITY_MEMORY.md`"
      ],
      "first_role": [
        "`Spec Architect`"
      ],
      "first_action": [
        "identify what the feature changes, what current assumption it may break, and what FB detail must exist before coding",
        "if market scan, similar-product review, or tool discovery would materially help, request user approval before any system-triggered research"
      ],
      "do_not": [
        "start implementing before specs are updated"
      ],
      "also_read_when_relevant": [
        "`<PROJECT_ROOT>/DATA_MODEL.md`",
        "`<PROJECT_ROOT>/API_CONTRACT.md`"
      ]
    },
    "continue": {
      "required_reads": [
        "`<PROJECT_ROOT>/SESSION_STATE.md`",
        "current function block",
        "current mission block",
        "current mission machine spec when it exists",
        "required input artifacts when the current FB or MB depends on them"
      ],
      "first_role": [
        "`Builder` if the state is healthy",
        "`Spec Architect` or `Recovery Coordinator` if the state is blocked or drifting"
      ],
      "first_action": [
        "name the current stage and the next single action",
        "if harness execution is used, run `preflight.py --level mb` before invoking the Builder loop",
        "if a bounded technical gap needs external facts, request user approval before any system-triggered research"
      ],
      "do_not": [
        "restart the whole project from zero"
      ],
      "also_read_when_needed": [
        "`docs/04_review_recovery.md`"
      ]
    },
    "review": {
      "required_reads": [
        "`<PROJECT_ROOT>/CONSTITUTION.md`",
        "`<PROJECT_ROOT>/SCOPE.md`",
        "relevant function block",
        "relevant mission block",
        "relevant input artifacts or design authority when the parent FB depends on them",
        "relevant contract files",
        "`docs/04_review_recovery.md`",
        "`schemas/quality-report.schema.json`"
      ],
      "first_role": [
        "`Reviewer`"
      ],
      "first_action": [
        "audit against written artifacts and evidence"
      ],
      "do_not": [
        "patch code during the review pass unless the user changes the task"
      ]
    },
    "recovery": {
      "required_reads": [
        "`<PROJECT_ROOT>/SESSION_STATE.md`",
        "current function block if it exists",
        "current mission block if it exists",
        "`<PROJECT_ROOT>/VERSION_LOG.md` if it exists",
        "`<PROJECT_ROOT>/QUALITY_MEMORY.md` if it exists",
        "`docs/04_review_recovery.md`",
        "relevant broken-area artifacts"
      ],
      "first_role": [
        "`Recovery Coordinator`"
      ],
      "first_action": [
        "classify the failure and choose the smallest safe move"
      ],
      "do_not": [
        "continue implementation by instinct"
      ]
    }
  },
  "protocol_rules": {
    "three_layers": [
      "`PROTOCOL_ROOT`",
      "`RUNTIME_ROOT`",
      "`PROJECT_ROOT`"
    ],
    "core_principles": [
      "prefer the smallest useful scope",
      "prefer the fewest dependencies",
      "prefer the smallest safe change surface",
      "prefer the clearest design that can be explained and verified"
    ],
    "plain_writing_rule": "Use plain language first. For models, clarity comes mainly from: - stable structure - explicit rules - short sections - consistent labels - examples and templates It does not come mainly from: - emoji - decorative emphasis - many repeated punctuation marks - aggressive formatting noise Emoji and visual emphasis can help a human skim a document, but they rarely improve model compliance in a meaningful way. In long prompts they often become noise. Recommended style: - use short section titles - use numbered stages and named artifacts - use tables only when comparing options or responsibilities - use bold sparingly for one term, not whole paragraphs - keep one rule per bullet when possible Avoid: - stacked emoji - repeated `###`, `!!!`, or similar visual shouting - mixing policy, examples, and exceptions in the same paragraph",
    "preflight_rule": "Before `INIT`, the agent must run `Project Preflight` against the working path. The preflight must classify the project as: - `ready` - `bootstrap_required` - `blocked` If the result is `bootstrap_required`, initialize safe foundational files before entering the requested scene. If the result is `blocked`, ask only for the minimum missing context.",
    "research_rule": "`Research` is a support capability, not a new scene, role, or stage. Use it mainly in: - `Spec Architect` work during `DISCOVERY`, `SPEC`, or `FB_DETAILING` - `Builder` work inside the active `MB` Two trigger types are allowed: - `user_triggered`: the user explicitly asks for search or lookup work - `system_triggered`: the active role sees a material need for external facts, tools, references, or technical solutions Execution rule: - `user_triggered` research may run immediately - `system_triggered` research requires user approval before any search begins - do not perform silent network research Accepted uses include: - simple market scan or similar-product review during spec work - searching for mature tools, libraries, services, or open-source projects - checking official docs, issues, changelogs, or workarounds for a bounded technical problem - gathering UI references, component directions, rendering approaches, or style precedents Every research run must be captured in artifacts instead of living only in chat. At minimum, record: - `query` - `trigger_type` - `why_now` - `sources` - `facts` - `candidates` - `recommendation` - `impact_on_fb_or_mb` Write those results into one or more of: - `DECISIONS.md` - the active `FB` - the active `MB` - a `RESEARCH_NOTE`",
    "role_handoff_rule": "Scene paths define the sequence. Role handoffs define who owns the next step. Every scene must: - name the first active role - define the handoff condition for the next role - tell the user when a role change happens - require user confirmation before entering a higher-cost or higher-risk work type The Builder must not start from raw chat history. The Builder starts only after reading: - project constitution - quality rulebook - relevant feature or scope spec - current function block - current mission block - required input artifacts when the current `FB` or `MB` depends on them - current session state If one of those is missing, the Builder must stop and request the missing artifact rather than infer it.",
    "issue_routing_rule": "Do not use vague fallback such as \"go back one step\". When a problem is found, route it by ownership: | Issue Type | Meaning | Route To | | :--- | :--- | :--- | | `spec_gap` | Goal, scope, acceptance, or contract is unclear or contradictory | `Spec Architect` | | `implementation_bug` | Specs are clear, but implementation is wrong | `Builder` | | `quality_evidence_gap` | Required checks, evidence, or quality report items are missing | `Builder` | | `state_drift` | `SESSION_STATE`, active `FB/MB`, or repository references do not match reality | `Recovery Coordinator` | | `environment_issue` | Toolchain, dependency, or runtime state blocks safe progress | `Recovery Coordinator` | | `review_context_gap` | The current actor lacks required context to make a safe judgment | current scene lead role | This rule applies in: - `Preflight` - scene work - build - review - recovery",